<magazzino xmlns="http://www.zoo.com" xmlns:xs="http://www.w3.org/2001/XMLSchema-instance" xs:schemaLocation="http://www.zoo.com warehouse.xsd">
<cibo nome="carne" quantita="44" id="4"><area>4</area><area>6</area></cibo><cibo nome="foglie" quantita="55" id="5"><area>2</area></cibo><cibo nome="arbusti" quantita="22" id="2"><area>3</area></cibo><cibo nome="banane" quantita="15" id="1"><area>1</area></cibo><cibo nome="erba" quantita="67" id="3"><area>5</area></cibo></magazzino>